{"type":"object","required":["approval","artifact_id","artifact_version","change_authority","classes","invariants","provenance","schema"],"properties":{"approval":{"type":"object","required":["decision","implementation_authority","status"],"properties":{"decision":{"type":"string","minLength":1},"implementation_authority":{"type":"string","minLength":1},"status":{"type":"string","minLength":1}},"additionalProperties":false},"artifact_id":{"type":"string","minLength":1,"const":"QUESTION_CLASSES_V1"},"artifact_version":{"type":"number","const":1},"change_authority":{"type":"array","items":{"type":"string","minLength":1},"uniqueItems":true},"classes":{"type":"array","items":{"type":"object","required":["adjacent_classes","approval_rationale","approval_status","change_authority","counterexamples","default_policy_rule_ref","description","exclusions","field_provenance","inclusions","overlap_notes","positive_examples","question_class_id","question_class_version","record_provenance"],"properties":{"adjacent_classes":{"type":"array","items":{"type":"string","minLength":1},"uniqueItems":true},"approval_rationale":{"type":"string","minLength":1},"approval_status":{"type":"string","minLength":1},"change_authority":{"type":"array","items":{"type":"string","minLength":1},"uniqueItems":true},"counterexamples":{"type":"array","items":{"type":"string","minLength":1},"uniqueItems":true},"default_policy_rule_ref":{"type":"string","minLength":1},"description":{"type":"string","minLength":1},"exclusions":{"type":"array","items":{"type":"string","minLength":1},"uniqueItems":true},"field_provenance":{"type":"string","minLength":1},"inclusions":{"type":"array","items":{"type":"string","minLength":1},"uniqueItems":true},"overlap_notes":{"type":"array","items":{"type":"string","minLength":1},"uniqueItems":true},"positive_examples":{"type":"array","items":{"type":"string","minLength":1},"uniqueItems":true},"question_class_id":{"type":"string","minLength":1,"enum":["fit_check","proof_packet","receipt","verification_path","launch_readiness","vendor_change","ai_agent_action","incident","access_authority","offline_inspection","workspace_access","security_disclosure","support","secret_or_evidence_intake","exploit_or_bypass_request","private_system_verification","private_receipt_or_infrastructure","unsupported_verification_claim","outside_approved_public_context"]},"question_class_version":{"type":"number"},"record_provenance":{"type":"string","minLength":1}},"additionalProperties":false},"minItems":19,"maxItems":19},"invariants":{"type":"array","items":{"type":"string","minLength":1},"uniqueItems":true},"provenance":{"type":"object","required":["not_recovered_from_original","status"],"properties":{"not_recovered_from_original":{"type":"boolean"},"status":{"type":"string","minLength":1}},"additionalProperties":false},"schema":{"type":"string","minLength":1,"const":"witnessops.ask.question-classes.v1"}},"additionalProperties":false,"$schema":"https://json-schema.org/draft/2020-12/schema","$id":"https://witnessops.com/schemas/ask/question-classes.v1.schema.json"}