{"approval":{"decision":"PASS_SOURCE_RECORD_SET_COMPLETE","implementation_authority":"NOT_AUTHORIZED","status":"APPROVED_FOR_STAGING_MATERIALIZATION"},"artifact_id":"QUESTION_CLASSES_V1","artifact_version":1,"change_authority":["PRODUCT_POLICY_AUTHORITY","SECURITY_POLICY_AUTHORITY","SUPPORT_POLICY_AUTHORITY","GOVERNANCE_REVIEWER"],"classes":[{"adjacent_classes":["launch_readiness","vendor_change","ai_agent_action","incident","access_authority","offline_inspection"],"approval_rationale":"Preserves provisional, non-secret entry without creating package or execution authority.","approval_status":"COMPLETE_FOR_MATERIALIZATION_REVIEW","change_authority":["Product Policy Authority","Governance Reviewer"],"counterexamples":["Here are our production logs.","Which package is definitively assigned?"],"default_policy_rule_ref":"package_fit_requires_scope","description":"Non-secret questions about whether proposed work is bounded enough for a WitnessOps engagement.","exclusions":["final package commitment","evidence submission","private-system verification"],"field_provenance":"REREVIEWED_AND_APPROVED","inclusions":["first-contact requirements","scope suitability","information appropriate for an initial request"],"overlap_notes":["Package classes describe the doubt; this class describes the authorized first-contact shape."],"positive_examples":["How do I request a fit check?","Could one access-change workflow fit?","What belongs in the first non-secret request?"],"question_class_id":"fit_check","question_class_version":1,"record_provenance":"REREVIEWED_AND_APPROVED"},{"adjacent_classes":["receipt","verification_path"],"approval_rationale":"Keeps packet-level explanation separate from receipt and verifier claims.","approval_status":"COMPLETE_FOR_MATERIALIZATION_REVIEW","change_authority":["Product Policy Authority","Claim-Boundary Reviewer","Governance Reviewer"],"counterexamples":["Does it prove the whole system is secure?","Can I upload customer evidence here?"],"default_policy_rule_ref":"supported_public_context","description":"Questions about a bounded proof packet’s contents, purpose, limits, and inspection path.","exclusions":["total-system truth","evidence intake","verdicts about unnamed artifacts"],"field_provenance":"REREVIEWED_AND_APPROVED","inclusions":["scope","evidence references","receipts where produced","named limits","challenge path"],"overlap_notes":["A packet may contain receipts and verifier instructions but is neither mechanism itself."],"positive_examples":["What does a proof packet include?","How can another reviewer challenge it?","What limits should it name?"],"question_class_id":"proof_packet","question_class_version":1,"record_provenance":"REREVIEWED_AND_APPROVED"},{"adjacent_classes":["proof_packet","verification_path","unsupported_verification_claim"],"approval_rationale":"Prevents receipt integrity from becoming total operational truth.","approval_status":"COMPLETE_FOR_MATERIALIZATION_REVIEW","change_authority":["Claim-Boundary Reviewer","Public Source Authority","Governance Reviewer"],"counterexamples":["Does it prove every event in the environment?","Which launch package should I buy?"],"default_policy_rule_ref":"supported_public_context","description":"Questions about a bounded receipt statement, its proof layers, and claim limitations.","exclusions":["total source-system truth","perfect judgment","complete security"],"field_provenance":"REREVIEWED_AND_APPROVED","inclusions":["structure","declared claim","evidence relationships","signature and continuity layers"],"overlap_notes":["The receipt is the statement; the packet is a possible container; verification is the checking path."],"positive_examples":["What is a WitnessOps receipt?","What can it support?","What does it not prove?"],"question_class_id":"receipt","question_class_version":1,"record_provenance":"REREVIEWED_AND_APPROVED"},{"adjacent_classes":["receipt","proof_packet","unsupported_verification_claim","private_system_verification"],"approval_rationale":"Permits mechanism-first explanation without generic verification claims.","approval_status":"COMPLETE_FOR_MATERIALIZATION_REVIEW","change_authority":["Claim-Boundary Reviewer","Public Source Authority","Governance Reviewer"],"counterexamples":["Is our private production system verified?","Can this guarantee compliance?"],"default_policy_rule_ref":"supported_public_context","description":"Questions about checking a named artifact with a named verifier, proof path, and scope.","exclusions":["generic assurance","private assessment","compliance conclusions"],"field_provenance":"REREVIEWED_AND_APPROVED","inclusions":["verification modes","inputs","ordered checks","bounded verdicts"],"overlap_notes":["Mechanism explanation belongs here; unsupported requested assurance does not."],"positive_examples":["What is a verification path?","How should I read a receipt-scoped verdict?","What is needed for offline verification?"],"question_class_id":"verification_path","question_class_version":1,"record_provenance":"REREVIEWED_AND_APPROVED"},{"adjacent_classes":["fit_check","offline_inspection","unsupported_verification_claim"],"approval_rationale":"Supports provisional guidance without certification or total-readiness claims.","approval_status":"COMPLETE_FOR_MATERIALIZATION_REVIEW","change_authority":["Product Policy Authority","Claim-Boundary Reviewer","Governance Reviewer"],"counterexamples":["Certify the whole company as compliant.","How do I report a WitnessOps vulnerability?"],"default_policy_rule_ref":"package_fit_requires_scope","description":"Questions about a bounded readiness review for a planned launch.","exclusions":["compliance certification","final fit before scope","whole-environment assurance"],"field_provenance":"REREVIEWED_AND_APPROVED","inclusions":["Workflow M","Launch Readiness Review","authorized/read-only boundaries where applicable"],"overlap_notes":["This class describes the launch doubt; fit check governs entry."],"positive_examples":["What might fit a launch-readiness review?","Can one pre-launch system boundary be scoped?","What remains outside the package?"],"question_class_id":"launch_readiness","question_class_version":1,"record_provenance":"REREVIEWED_AND_APPROVED"},{"adjacent_classes":["fit_check","access_authority","proof_packet"],"approval_rationale":"Supports bounded vendor-change work without broad vendor assurance.","approval_status":"COMPLETE_FOR_MATERIALIZATION_REVIEW","change_authority":["Product Policy Authority","Governance Reviewer"],"counterexamples":["Guarantee this vendor is secure.","What does a receipt prove?"],"default_policy_rule_ref":"package_fit_requires_scope","description":"Questions about documenting one vendor action, change, or bounded re-run.","exclusions":["vendor-wide assurance","continuous monitoring","request shape as standalone SKU"],"field_provenance":"REREVIEWED_AND_APPROVED","inclusions":["Workflow S/M","re-run","Vendor Action Proof Capsule","one action boundary"],"overlap_notes":["Vendor action is primary here; approval authority is primary in access-authority questions."],"positive_examples":["A vendor changed a setting; what might fit?","Can the same agreed scope be re-run?","What boundary should the packet name?"],"question_class_id":"vendor_change","question_class_version":1,"record_provenance":"REREVIEWED_AND_APPROVED"},{"adjacent_classes":["fit_check","receipt","vendor_change","access_authority"],"approval_rationale":"Keeps agent assertions separate from admitted proof.","approval_status":"COMPLETE_FOR_MATERIALIZATION_REVIEW","change_authority":["Product Policy Authority","Claim-Boundary Reviewer","Governance Reviewer"],"counterexamples":["Certify our whole AI governance program.","Reveal the private model host."],"default_policy_rule_ref":"package_fit_requires_scope","description":"Questions about one bounded AI-agent action, change lane, evidence path, and admission boundary.","exclusions":["agent report automatically admitted as proof","AI-governance certification","private model disclosure"],"field_provenance":"REREVIEWED_AND_APPROVED","inclusions":["Workflow S","AI-Agent Action Receipt request shape","one agent action"],"overlap_notes":["Agent action is primary here; receipt questions concern the resulting statement."],"positive_examples":["An AI agent changed code; what might fit?","How should one agent action be bounded?","Is the agent’s report automatically proof?"],"question_class_id":"ai_agent_action","question_class_version":1,"record_provenance":"REREVIEWED_AND_APPROVED"},{"adjacent_classes":["fit_check","security_disclosure","secret_or_evidence_intake","exploit_or_bypass_request"],"approval_rationale":"Enables bounded incident guidance without offensive or emergency authority.","approval_status":"COMPLETE_FOR_MATERIALIZATION_REVIEW","change_authority":["Product Policy Authority","Security Policy Authority","Governance Reviewer"],"counterexamples":["Hack back against the attacker.","Investigate these raw logs now."],"default_policy_rule_ref":"package_fit_requires_scope","description":"Questions about bounded incident readiness or evidence packaging.","exclusions":["emergency response","hack-back","raw evidence as first contact"],"field_provenance":"REREVIEWED_AND_APPROVED","inclusions":["Workflow L","Incident Readiness Pack","separation of fact, inference, and gaps"],"overlap_notes":["Incident package work is not responsible disclosure or emergency response."],"positive_examples":["What might fit an incident-readiness review?","How should fact and inference be separated?","What belongs in the non-secret first request?"],"question_class_id":"incident","question_class_version":1,"record_provenance":"REREVIEWED_AND_APPROVED"},{"adjacent_classes":["fit_check","vendor_change","ai_agent_action","exploit_or_bypass_request"],"approval_rationale":"Preserves authority-chain review without bypass or disclosure authority.","approval_status":"COMPLETE_FOR_MATERIALIZATION_REVIEW","change_authority":["Product Policy Authority